{
  "build": {
    "app_id": "217980",
    "architecture": "x86",
    "build_id": "10256413",
    "executable_sha256": "66443F3D68A6C658B0ED943260C3EB2F4CC9E3400D5809A94D6EC41EB725E17E",
    "image_base": "0x00400000",
    "module": "Dishonored.exe"
  },
  "generated_by": {
    "sha256": "206d6798be0ebd716e259c3eed35e448a4ff2824a9ece96ca00e7c7732107564",
    "tool": "tools/export_function_coverage.py",
    "version": 1
  },
  "inputs": [
    {
      "path": "research/executable/functions.csv",
      "rows": 72437,
      "sha256": "f8f9f7fd7229056904f779d8d065d43dd16f31f3079304e84c32110bc3537a03"
    },
    {
      "path": "research/executable/evidence/function-triage/internal-function-triage.csv",
      "rows": 72437,
      "sha256": "f726b8d26de28a9d78398c1d856ee5cedccafe8022267327b0562c40ef5b9b77"
    },
    {
      "path": "research/executable/evidence/function-triage/internal-function-triage-summary.json",
      "sha256": "da7ba1225f09dbf2584883687dfca271d97a3a98adb0f0d0008aec5c9c7cbea5"
    },
    {
      "path": "research/executable/evidence/function-triage/manual-review-overlay-cumulative-EXP-0155.csv",
      "rows": 47,
      "sha256": "4d1536d07d06cdfc57da69e5379744f8eafdddcbd72c988685afe57868255ad7"
    },
    {
      "path": "research/executable/evidence/function-triage/manual-review-overlay-summary-EXP-0155.json",
      "sha256": "4e0f0eb03e8aea16b84c348e038d141da2d0cba6b441f0c060939b99b10e596e"
    },
    {
      "path": "research/executable/evidence/function-triage/curated-function-claims-EXP-0155.json",
      "sha256": "9868f97f7c2c938698a4ce5792d8961429df397a1e12609a9cba49fb77789b85"
    },
    {
      "path": "schemas/curated-function-claims.schema.json",
      "sha256": "18e17581a533d1b7b44b67902a4e6b234d9eb71a3919f50d5a39617f469ac62c"
    },
    {
      "path": "schemas/function-coverage-export.schema.json",
      "sha256": "0784565bccf2cc4d078b84e01eb4999959e2558040a3692bf2eb521d0f801ec5"
    },
    {
      "path": "research/builds/BUILD-STEAM-10256413/build.md",
      "sha256": "7e8b9992a37b1003ae068e8d293e4b9e718ad2384b19627a4f864c5c8f1a6e9f"
    },
    {
      "path": "knowledge/database/schema.sql",
      "sha256": "d1e63db79dddc87c07a77c677ad350da3608a10926fceca59c6192dff16694a7"
    },
    {
      "path": "tools/knowledge/sync_from_experiments.py",
      "sha256": "ffd03d01cfd7f992214b9f5f956368c97f4af214aa133556eab7c05c38702186"
    },
    {
      "path": "docs/methodology/function-evidence-model.md",
      "sha256": "382b6cf40992938e0f2446f8bfc7eeaf368fcc9a42c15ba4d0e6a65acf3e10cf"
    },
    {
      "path": "experiments/EXP-0041-ghidra-function-count-reconciliation.md",
      "sha256": "cb70e2e89da2cb69c1f5f91500f403f4b554afa81ebbf8486f93482d45b37fd2"
    },
    {
      "path": "experiments/EXP-0072-exact-build-internal-function-subsystem-triage.md",
      "sha256": "32041c85f128a86b21ec2b22d68c9354eece452bd571a3bbdc52b2bd3bd8aa17"
    },
    {
      "path": "experiments/EXP-0155-set-enabled-shared-native-adapter.md",
      "sha256": "a4df830dd0df401a473c637536e7f32c195d16b98c9c1e2a2c8d594c3343b725"
    }
  ],
  "limitations": [
    "The exporter consumes the committed function index; it does not re-index the executable or launch Ghidra.",
    "The executable, Ghidra project and SQLite database are not read. Build identity is taken from the recorded build file and source EXP metadata.",
    "L0-L2 represent the highest evidence level recoverable from the listed portable inputs. L3 and L4 are not exported; their absence here is not proof that an ignored local database has no such rows.",
    "The EXP-0072 label/callgraph triage is a static candidate baseline, not semantic ownership or runtime reachability.",
    "The CSV's connectivity_axis and runtime_axis are marked not_exported rather than inferred from missing local database rows."
  ],
  "measurements": {
    "analysis": {
      "analyzed": 54,
      "curated_records": 7,
      "indexed_only": 72383,
      "manual_review_overlay": 47
    },
    "denominator": 72437,
    "portable_highest_known_level": {
      "L0": 72383,
      "L1": 50,
      "L2": 4
    },
    "semantic_claims": {
      "confirmed": 4,
      "no_portable_claim": 72430,
      "other_claims": 3
    },
    "triage_baseline": {
      "symbol_name_candidates": 439,
      "unknown_subsystem": 71998
    },
    "unpublished_levels": [
      "L3",
      "L4"
    ]
  },
  "metric_scope": "Repository-published function evidence only. This export is not a snapshot of arbitrary rows in the ignored local SQLite database.",
  "per_function_export": {
    "columns": [
      "address",
      "rva",
      "name",
      "signature",
      "size_bytes",
      "analysis_axis",
      "analysis_source",
      "review_status",
      "overlay_claim_status",
      "semantic_axis",
      "claim_status",
      "claim_summary",
      "claim_source",
      "connectivity_axis",
      "runtime_axis",
      "highest_portable_evidence_level"
    ],
    "path": "research/executable/evidence/function-triage/function-coverage-EXP-0155.csv",
    "rows": 72437,
    "sha256": "73b81e547d6be71c8e2c6c0f1984b7e984518e4393a6a786ff21f588934901b3"
  },
  "schema_version": 1,
  "source_records": [
    {
      "claim_status": "confirmed",
      "id": "EXP-0041",
      "path": "experiments/EXP-0041-ghidra-function-count-reconciliation.md",
      "sha256": "cb70e2e89da2cb69c1f5f91500f403f4b554afa81ebbf8486f93482d45b37fd2"
    },
    {
      "claim_status": "mixed",
      "id": "EXP-0072",
      "path": "experiments/EXP-0072-exact-build-internal-function-subsystem-triage.md",
      "sha256": "32041c85f128a86b21ec2b22d68c9354eece452bd571a3bbdc52b2bd3bd8aa17"
    },
    {
      "claim_status": "mixed",
      "id": "EXP-0155",
      "path": "experiments/EXP-0155-set-enabled-shared-native-adapter.md",
      "sha256": "a4df830dd0df401a473c637536e7f32c195d16b98c9c1e2a2c8d594c3343b725"
    }
  ]
}
